{
  "productId": "AIT-BRG-6205",
  "partNumber": "6205-2RS",
  "name": "Deep Groove Ball Bearing 6205-2RS",
  "description": "Single row deep groove ball bearing with rubber seals on both sides",
  "category": "Bearings",
  "manufacturer": "SKF",
  "price": 12.5,
  "inStock": true,
  "leadTimeDays": 0
}